Day,Status,Market Window,> 21e,Cash -/+,Beg NLV,End NLV,Daily $ Change,Daily % Change,% Invested,SPY,Nasdaq,Market_Notes,Market_Action,Score,Highlights,Lowlights,Mistakes,Top_Lesson
2026-02-10,U,Open,0,0.0,108364.0,108364.0,990026.05,913.90%,0.0,692.1199951171875,23102.4707,Nasdaq get rejected at the 21e. High beta stocks sell off ,,5,,,,
2026-02-09,U,Open,0,0.0,108364.0,108364.0,8.580000000001746,0.01%,0.0,694.0499877929688,23238.66992,,,4,,Was chasing some old names that I like,Be patient. Remove FOMO. It is ok to miss a move. ,
2026-02-06,U,Open,0,0.0,108364.0,108364.0,0.0,0.00%,0.0,690.6199951171875,23031.21289,Market rebounds from hard selling. Is this the low?,No Change,3,Stayed calm ,Could've done so much better. ,,
2026-02-05,U,Open,0,0.0,108364.0,108364.0,-7.63,-0.01%,0.0,677.6199951171875,22540.58594,Market window officials closed. The selling intensifies ,,1,,Terrible trading. Continued FOMO,Bought PL when market window was closed. ,Conviction to go defensive earlier. 
2026-02-04,U,Open,0,0.0,112953.45,108364.0,-4624.45,-4.09%,0.0,686.1900024414062,22904.58008,Growth stocks get hit hard. Nasdaq tumbles again,SELL: TQQQ,1,,Couldn't stay disciplined. Bought stocks and wasn't supposed to,,Stay discipline. Don't have FOMO
2026-02-03,U,Open,0,0.0,118505.33,112953.45,-5551.88,-4.68%,95.85895782731735,689.5300293,23255.18555,Market tumbles again. Memory and Space Themes working,SELL: UPRO,5,,,,
2026-02-02,U,Open,0,0.0,115371.23,118505.33,3134.100000000006,2.72%,100.76930716955938,695.4099731445312,23592.10742,Market rebounds to start the week,No Change,5,Executed plan very well,,,
2026-01-30,U,Open,0,0.0,120637.39,115371.23,-5266.16,-4.37%,100.78855881141251,691.9699707,23461.82031,Heavy market sell off of beta stocks. Portfolio rocked ,No Change,2,,No offensive selling,Need to me more aggressive in selling offensively ,Got to start big and take profit 
2026-01-29,U,Open,0,0.0,123141.03,120637.39,-2503.64,-2.03%,100.75234552073782,694.0700073242188,23685.12109,Market got rocked on no apparent macro news ,No Change,4,,,,
2026-01-28,U,Open,0,0.0,121051.53,123141.03,2089.5,1.73%,109.5402564035724,695.5599975585938,23857.44727,Market surges higher. FOMC leaves rate unchanged,No Change,5,,,,
2026-01-27,U,Open,0,0.0,118933.65,121051.53,2117.88,1.78%,110.5306145,695.5050049,23817.09766,Market rebounds. High beta stocks shine,ADD: TQQQ,5,,,,
2026-01-26,U,Open,0,0.0,116860.48,118933.65,2073.17,1.77%,100.3475467,692.7600098,23601.35742,Indices marching higher. Space names clobbered. ,No Change,5,,,,
2026-01-23,U,Open,0,0.0,116367.21,116860.48,493.27,0.42%,100.3538579,689.2299805,23501.24414,High beta stocks sell off while market is flat ,No change,5,,,,
2026-01-22,U,Open,0,0.0,113953.75,116367.21,2413.46,2.12%,100.3547305,688.9799805,23436.01953,Market follows up from yesterday recovery,No change,4,Followed rules,stops are too obvious,,Need to assume pb to top of base in determining stops
2026-01-21,U,Open,0,0.0,109648.96,113953.75,4304.79,3.93%,100.3626471,685.4000244,23224.82422,"Bullish, broad rebound on Greenland framework of deal",No change,3,,,,
2026-01-20,U,Open,0,0.0,116973.95,109648.96,-7324.99,-6.26%,100.376693,677.5599976,22954.32227,Market tanks on DT Tweet about EU tariffs,No Change,5,Did not panic on market sell off day. Followed rules,,,Have a plan for big red day and execute. 
2026-01-16,U,Open,0,0.0,117290.5,116973.95,-316.55,-0.27%,100.3522579,691.6599731,23515.38672,Indices are flat again. High beta stocks still flying,No Change,4,Overall followed rules,Too quick selling LEU,Better way to reduce exposure,
2026-01-15,U,Open,0,0.0,115289.65,117290.5,2000.85,1.74%,100.281779,692.2399902,23530.02148,Market gaps up and sells off. ,No Changes,5,Traded well today. ,,,
2026-01-14,U,Open,0,0.0,119497.01,115289.65,-4207.36,-3.52%,100.865082,690.36,23471.75,Market sells off. Mags 7 continues to tank,No Changes,2,,Emotional. Too much action. FOMO,Buying stocks that stopped out due to FOMO,Respect the levels and stops. 
2026-01-13,U,Open,0,0.0,120218.34,119497.01,-721.33,-0.60%,100.8167485,693.7700195,23709.87305,Market Volatile and flat after CPI Data,,5,,,,
2026-01-12,U,Open,0,0.0,120050.96,120218.34,167.38,0.14%,100.8115733,695.1599731,23733.9043,Market shrugs off J Powell investigation ,No Change,5,Added back to FIGR realizing natural move,,,Don't make stop loss too obvious
2026-01-09,U,Open,0,0.0,116616.49,120050.96,3434.47,2.95%,100.8130214,694.0700073,23671.3457,Market rebounds after 2 days selloff. Small caps lead ,No Changes,3,Managing risk well,Mismanaged RDDT,Stops in illogical places. Need to review more carefully ,Consider MAs in determining scale in stop positions 
2026-01-08,U,Open,0,0.0,118456.94,116616.49,-1840.45,-1.55%,100.8270786,689.5100098,23480.01563,Market falls again. Portfolio is mixed ,No changes,3,,,,
2026-01-07,U,Open,0,0.0,118805.9,118456.94,-348.96,-0.29%,100.8222904,689.5800171,23584.27539,Market fades late. TQQQ signal triggered ,ADD: TQQQ,3,Overall I'm reading the market well,I bought ASTS on weakness. I was impatient ,Wait for rebound on pullbacks,be patient on adding on pullback
2026-01-06,U,Open,0,0.0,118712.73,118805.9,93.17,0.08%,13.0826836,691.8099976,23547.17188,"Dow, S&P 500 hit record highs - Leaders are working",BUY: TQQQ-UPRO,4,Followed rules. Took profit,Missed alerts to size up on SNDK,,Need to set buy stop orders. 
2026-01-05,U,Open,0,0.0,118712.72,118712.73,0.01,0.00%,0.0,687.7199707,23395.82227,US arrests Maduro - Market continues higher ,No Change,2,Increase exposure and bought stocks that met my criteria,Added aggressively to ALAB,Did move my ALAB stop to respect my initial risk,Immediately raise stop 
2026-01-02,U,Open,0,0.0,119911.85,118712.72,-1199.13,-1.00%,0.0,683.1699829,23235.62891,Market down. Select growth stocks on fire,SELL: TQQQ-UPRO,0,0,0,0,0
2025-12-31,U,Open,0,0.0,123107.0,119911.85,-3195.15,-2.60%,96.65683583,681.9199829,23241.99023,Market tumbles into new year. Terrible close of the year,No Changes,0,0,0,0,0
2025-12-30,U,Open,0,0.0,123893.86,123107.0,-786.86,-0.64%,96.74267101,687.0100098,23419.08008,Market flat again. Very low volume on shorten week,No Changes,0,0,0,0,0
2025-12-29,U,Open,0,0.0,125246.93,123893.86,-1353.07,-1.08%,96.76427871,687.8499756,23474.34961,Nasdaq sells off from highs but closed well,No Changes,0,0,0,0,0
2025-12-26,U,Open,0,0.0,125566.36,125246.93,-319.43,-0.25%,96.81514749,690.3099976,23593.0957,Day after Xmas blues. Indices are flat. High Beta stocks sell off ,,0,0,0,0,0
2025-12-24,U,Open,0,0.0,125139.15,125566.36,427.21,0.34%,96.83087094,690.3800049,23613.30664,Shorten Holiday Trading Day. SPX makes ATH. Mixed actions on growth stocks,BUY: TQQQ-UPRO,0,0,0,0,0
2025-12-23,U,Open,0,0.0,125139.15,125139.15,0.0,0.00%,0.0,687.960022,23561.84375,SPX all time high on NVDA move. Choppy action still ,,0,0,0,0,0
2025-12-22,U,Open,0,0.0,125139.15,125139.15,0.0,0.00%,0.0,684.7199707,23428.83008,Market gaps up above 21e. Mixed actions around ,,0,0,0,0,0
2025-12-19,U,Open,0,0.0,125139.15,125139.15,0.0,0.00%,0.0,680.5900269,23307.61914,Market follows through on Quad Witching Day ,,0,0,0,0,0
2025-12-18,U,Open,0,0.0,125139.15,125139.15,0.0,0.00%,0.0,676.4699707,23006.36133,Market rebounds on great CPI Data. Still choppy,,0,0,0,0,0
2025-12-17,U,Open,0,0.0,125139.15,125139.15,0.0,0.00%,0.0,674.6799927,22850.30469,,,0,0,0,0,0
2025-12-16,U,Open,0,0.0,125139.15,125139.15,0.0,0.00%,0.0,674.664978,22852.45508,,,0,0,0,0,0
2025-12-15,U,Open,0,127401.84,0.0,125139.15,-2262.69,-1.78%,0.0,675.039978,22896.90234,,,0,0,0,0,0
